{"$schema":"https://json-schema.org/draft/2020-12/schema","$id":"https://devflow.local/schemas/milestone-external-effects-contract-v1.schema.json","title":"DevFlow Standing Milestone External Effects Contract","type":"object","additionalProperties":false,"required":["schemaVersion","contractId","goalId","goal","change","milestone","plugin","repository","commit","publication","requestedEffects","writeSet","refreshTargets","failurePolicy","reentryPolicy","exclusions"],"properties":{"schemaVersion":{"const":"1.0"},"contractId":{"$ref":"#/$defs/nonBlankString"},"goalId":{"$ref":"#/$defs/nonBlankString"},"goal":{"$ref":"#/$defs/nonBlankString"},"change":{"$ref":"#/$defs/nonBlankString"},"milestone":{"$ref":"#/$defs/nonBlankString"},"plugin":{"$ref":"#/$defs/plugin"},"repository":{"$ref":"#/$defs/repository"},"commit":{"$ref":"#/$defs/commit"},"publication":{"$ref":"#/$defs/publication"},"requestedEffects":{"$ref":"#/$defs/requestedEffects"},"writeSet":{"$ref":"#/$defs/safeRelativePaths"},"refreshTargets":{"$ref":"#/$defs/refreshTargets"},"failurePolicy":{"$ref":"#/$defs/failurePolicy"},"reentryPolicy":{"$ref":"#/$defs/reentryPolicy"},"exclusions":{"$ref":"#/$defs/exclusions"}},"$defs":{"nonBlankString":{"type":"string","pattern":"^(?=\\S)(?:[^\\u0000\\r\\n]*\\S)?$"},"identifier":{"type":"string","pattern":"^[A-Za-z0-9](?:[A-Za-z0-9._-]*[A-Za-z0-9])?$"},"nonEmptyUniqueStrings":{"type":"array","minItems":1,"uniqueItems":true,"items":{"$ref":"#/$defs/nonBlankString"}},"safeRelativePaths":{"type":"array","minItems":1,"uniqueItems":true,"items":{"type":"string","pattern":"^(?!/)(?!.*(?:^|/)\\.\\.(?:/|$))(?!.*//)(?!.*\\\\)[^\\u0000\\r\\n]+$"}},"plugin":{"type":"object","additionalProperties":false,"required":["id","marketplace","versionRule","version"],"properties":{"id":{"$ref":"#/$defs/identifier"},"marketplace":{"$ref":"#/$defs/identifier"},"versionRule":{"$ref":"#/$defs/identifier"},"version":{"type":"string","pattern":"^[0-9]+\\.[0-9]+\\.[0-9]+(?:[-+][0-9A-Za-z.-]+)?$"}}},"repository":{"type":"object","additionalProperties":false,"required":["remote","remoteUrl","ref","expectedBase"],"properties":{"remote":{"$ref":"#/$defs/identifier"},"remoteUrl":{"type":"string","pattern":"^(?:/|[A-Za-z][A-Za-z0-9+.-]*://|[^\\s/@:]+@[^\\s/:]+:)[^\\s\\u0000\\r\\n]+$"},"ref":{"type":"string","pattern":"^refs/heads/(?!.*\\.\\.)(?!.*//)(?!.*@\\{)(?!.*\\.lock(?:/|$))[A-Za-z0-9._/-]*[A-Za-z0-9_-]$"},"expectedBase":{"type":"string","pattern":"^[0-9a-f]{40}$"}}},"commit":{"type":"object","additionalProperties":false,"required":["message"],"properties":{"message":{"$ref":"#/$defs/nonBlankString"}}},"publication":{"type":"object","additionalProperties":false,"required":["tag","channel","mechanism","workflow","assets","assetExpectation"],"properties":{"tag":{"type":"string","pattern":"^(?!.*\\.\\.)(?!.*//)(?!.*@\\{)[A-Za-z0-9][A-Za-z0-9._/-]*[A-Za-z0-9]$"},"channel":{"$ref":"#/$defs/nonBlankString"},"mechanism":{"const":"github_actions"},"workflow":{"type":"string","pattern":"^\\.github/workflows/(?!.*\\.\\.)(?!.*//)[^\\u0000\\r\\n]+\\.ya?ml$"},"assets":{"type":"array","minItems":1,"uniqueItems":true,"items":{"type":"string","pattern":"^(?=\\S)(?=[^\\u0000\\r\\n]*\\S$)[^/\\\\\\u0000\\r\\n]+$"}},"assetExpectation":{"type":"string","pattern":"^(?!/)(?!.*(?:^|/)\\.\\.(?:/|$))(?!.*//)(?!.*\\\\)[^\\u0000\\r\\n]+$"}}},"requestedEffects":{"type":"array","minItems":7,"maxItems":7,"prefixItems":[{"const":"git.commit"},{"const":"git.push"},{"const":"git.tag.push"},{"const":"github.release"},{"const":"devflow.source.fast_forward"},{"const":"codex.cache.refresh"},{"const":"devflow.project.refresh"}],"items":false},"refreshTargets":{"type":"object","additionalProperties":false,"required":["cache","project"],"properties":{"cache":{"type":"string","pattern":"^[A-Za-z0-9](?:[A-Za-z0-9._-]*[A-Za-z0-9])?@[A-Za-z0-9](?:[A-Za-z0-9._-]*[A-Za-z0-9])?$"},"project":{"type":"string","pattern":"^/(?!.*(?:^|/)\\.\\.(?:/|$))(?!.*//)[^\\u0000\\r\\n]+$"}}},"failurePolicy":{"type":"object","additionalProperties":false,"required":["preserveCommit","preserveTag","maxDiagnoses","maxRemediations","allowAlternatePublication"],"properties":{"preserveCommit":{"const":true},"preserveTag":{"const":true},"maxDiagnoses":{"const":1},"maxRemediations":{"const":1},"allowAlternatePublication":{"const":false}}},"reentryPolicy":{"type":"object","additionalProperties":false,"required":["sameIdentityOnly","resume","duplicateEffects"],"properties":{"sameIdentityOnly":{"const":true},"resume":{"const":"first_incomplete_step"},"duplicateEffects":{"const":false}}},"exclusions":{"type":"array","minItems":9,"maxItems":9,"prefixItems":[{"const":"archive"},{"const":"force-push"},{"const":"game-dev-plugins"},{"const":"merge"},{"const":"pr"},{"const":"rebase"},{"const":"unnamed-consumer"},{"const":"unnamed-plugin"},{"const":"unrelated-release"}],"items":false}}}
