{
  "schemaVersion": "1.0",
  "contractId": "dev-flow-authority-delta-v0.4.0",
  "goalId": "019fdf0e-4539-7f93-88db-8574f952c115",
  "goal": "Systemically reduce false Human Gates while preserving fail-closed safety and publish the verified DevFlow 0.4.0 milestone.",
  "change": "centralize-devflow-authority-delta",
  "milestone": "dev-flow-authority-delta-v0.4.0",
  "plugin": {
    "id": "dev-flow",
    "marketplace": "cy-codex-skills",
    "versionRule": "first-non-breaking-capability-release-after-0.3.x",
    "version": "0.4.0"
  },
  "repository": {
    "remote": "origin",
    "remoteUrl": "git@github.com:cYz26/cy-codex-skills.git",
    "ref": "refs/heads/main",
    "expectedBase": "9366e8ae63752a9ce86bd52a814233ca74edc16e"
  },
  "commit": {
    "message": "feat(dev-flow): centralize authority-delta execution"
  },
  "publication": {
    "tag": "dev-flow-v0.4.0",
    "channel": "stable",
    "mechanism": "github_actions",
    "workflow": ".github/workflows/publish-dev-flow.yml",
    "assetExpectation": "openspec/changes/centralize-devflow-authority-delta/evidence/dev-flow-0.4.0.release-assets.json",
    "assets": [
      "dev-flow-0.4.0.zip",
      "dev-flow-0.4.0.release-manifest.json",
      "dev-flow-0.4.0.sha256",
      "devflow_runtime.pyz",
      "devflow_runtime.MANIFEST.json",
      "devflow_runtime.sha256",
      "dev-flow-v0.4.0.md"
    ]
  },
  "requestedEffects": [
    "git.commit",
    "git.push",
    "git.tag.push",
    "github.release",
    "devflow.source.fast_forward",
    "codex.cache.refresh",
    "devflow.project.refresh"
  ],
  "writeSet": [
    ".github/workflows/publish-dev-flow.yml",
    ".planning/devflow/STATE.md",
    ".planning/devflow/checkpoints/2026-08-08-planned-centralize-devflow-authority-delta.md",
    ".planning/devflow/release-verification/dev-flow.json",
    ".planning/devflow/verification/20260809-standing-goal-execution-authority-system-repair.md",
    "AGENTS.md",
    "ENGINEERING_POLICY.md",
    "TASK_LEDGER.md",
    "dev/plugins/dev-flow/.codex-plugin/plugin.json",
    "dev/plugins/dev-flow/.codex-plugin/project-migration.json",
    "dev/plugins/dev-flow/.codex-plugin/release-sync.json",
    "dev/plugins/dev-flow/README.md",
    "dev/plugins/dev-flow/assets/templates/AGENTS.md.template",
    "dev/plugins/dev-flow/assets/templates/AGENT_TASK_CONTRACT.md.template",
    "dev/plugins/dev-flow/assets/templates/ENGINEERING_POLICY.md.template",
    "dev/plugins/dev-flow/assets/templates/EVIDENCE_TEMPLATE.md.template",
    "dev/plugins/dev-flow/assets/templates/OPENSPEC_CONFIG.yaml.template",
    "dev/plugins/dev-flow/assets/templates/OPENSPEC_DESIGN.md.template",
    "dev/plugins/dev-flow/assets/templates/OPENSPEC_TASKS.md.template",
    "dev/plugins/dev-flow/assets/templates/REVIEW_CHECKLIST.md.template",
    "dev/plugins/dev-flow/assets/templates/STATE.md.template",
    "dev/plugins/dev-flow/assets/templates/TASK_LEDGER.md.template",
    "dev/plugins/dev-flow/docs/artifact-ownership.md",
    "dev/plugins/dev-flow/docs/dev-flow-0.4.0.release-manifest.json",
    "dev/plugins/dev-flow/docs/dev-flow-release-policy.json",
    "dev/plugins/dev-flow/docs/dev-flow-v0.4.0.md",
    "dev/plugins/dev-flow/docs/generated-artifact-lifecycle.md",
    "dev/plugins/dev-flow/docs/git_transport_routing.md",
    "dev/plugins/dev-flow/docs/side_effect_policy.json",
    "dev/plugins/dev-flow/fixtures/milestone-external-effects/long-run-v1.json",
    "dev/plugins/dev-flow/fixtures/milestone-external-effects/standing-contract-v1.json",
    "dev/plugins/dev-flow/fixtures/project-refresh/authority-milestone-cases-v10.json",
    "dev/plugins/dev-flow/fixtures/project-refresh/standing-execution-cases-v11.json",
    "dev/plugins/dev-flow/fixtures/test_generated_artifact_lifecycle.py",
    "dev/plugins/dev-flow/schemas/authority-delta-resolution-v1.schema.json",
    "dev/plugins/dev-flow/schemas/authority-gate-receipt-v1.schema.json",
    "dev/plugins/dev-flow/schemas/milestone-candidate-manifest-v1.schema.json",
    "dev/plugins/dev-flow/schemas/milestone-effect-receipt-v1.schema.json",
    "dev/plugins/dev-flow/schemas/milestone-external-effects-contract-v1.schema.json",
    "dev/plugins/dev-flow/schemas/milestone-review-evidence-v1.schema.json",
    "dev/plugins/dev-flow/schemas/milestone-review-receipt-v1.schema.json",
    "dev/plugins/dev-flow/schemas/milestone-terminal-receipt-v1.schema.json",
    "dev/plugins/dev-flow/schemas/milestone-validation-evidence-v1.schema.json",
    "dev/plugins/dev-flow/schemas/milestone-validation-receipt-v1.schema.json",
    "dev/plugins/dev-flow/scripts/authority_gate.py",
    "dev/plugins/dev-flow/scripts/devflow_stop_hook.py",
    "dev/plugins/dev-flow/scripts/git_transport_preflight.py",
    "dev/plugins/dev-flow/scripts/milestone_external_effects.py",
    "dev/plugins/dev-flow/scripts/release_promotion_gate.py",
    "dev/plugins/dev-flow/scripts/verify_release_runtime.py",
    "dev/plugins/dev-flow/scripts/workflow_authority_delta.py",
    "dev/plugins/dev-flow/scripts/workflow_authority_gate.py",
    "dev/plugins/dev-flow/scripts/workflow_continuation.py",
    "dev/plugins/dev-flow/scripts/workflow_generated_artifacts.py",
    "dev/plugins/dev-flow/scripts/workflow_git.py",
    "dev/plugins/dev-flow/scripts/workflow_milestone_contract.py",
    "dev/plugins/dev-flow/scripts/workflow_milestone_external_effects.py",
    "dev/plugins/dev-flow/scripts/workflow_milestone_real_boundaries.py",
    "dev/plugins/dev-flow/scripts/workflow_release_sync.py",
    "dev/plugins/dev-flow/scripts/workflow_release_verification.py",
    "dev/plugins/dev-flow/scripts/workflow_side_effect_policy.py",
    "dev/plugins/dev-flow/scripts/workflow_standing_milestone.py",
    "dev/plugins/dev-flow/scripts/workflow_state.py",
    "dev/plugins/dev-flow/scripts/workflow_validate.py",
    "dev/plugins/dev-flow/skills/ai-native-tech-plan/SKILL.md",
    "dev/plugins/dev-flow/skills/change-plan/SKILL.md",
    "dev/plugins/dev-flow/skills/dev-flow-refresh/SKILL.md",
    "dev/plugins/dev-flow/skills/execute-task/SKILL.md",
    "dev/plugins/dev-flow/skills/feature-intake/SKILL.md",
    "dev/plugins/dev-flow/skills/plugin-project-migration/SKILL.md",
    "dev/plugins/dev-flow/skills/project-orchestrator/SKILL.md",
    "dev/plugins/dev-flow/skills/verify-and-archive/SKILL.md",
    "dev/plugins/dev-flow/skills/workflow-doctor/SKILL.md",
    "dev/plugins/dev-flow/tests/test_authority_delta_policy.py",
    "dev/plugins/dev-flow/tests/test_authority_gate.py",
    "dev/plugins/dev-flow/tests/test_auto_clean_orchestration.py",
    "dev/plugins/dev-flow/tests/test_continuous_execution_contract.py",
    "dev/plugins/dev-flow/tests/test_devflow_release_bundle.py",
    "dev/plugins/dev-flow/tests/test_git_transport_preflight.py",
    "dev/plugins/dev-flow/tests/test_implementation_readiness.py",
    "dev/plugins/dev-flow/tests/test_milestone_contract.py",
    "dev/plugins/dev-flow/tests/test_milestone_external_effects.py",
    "dev/plugins/dev-flow/tests/test_milestone_real_boundaries.py",
    "dev/plugins/dev-flow/tests/test_project_orchestrator.py",
    "dev/plugins/dev-flow/tests/test_project_refresh.py",
    "dev/plugins/dev-flow/tests/test_release_asset_expectation.py",
    "dev/plugins/dev-flow/tests/test_release_smoke.py",
    "dev/plugins/dev-flow/tests/test_release_sync.py",
    "dev/plugins/dev-flow/tests/test_runtime_gates.py",
    "dev/plugins/dev-flow/tests/test_standing_milestone.py",
    "dev/scripts/package_devflow_release_bundle.py",
    "dev/scripts/package_devflow_release_runtime.py",
    "dev/scripts/run_devflow_prepromotion_tests.py",
    "dev/scripts/verify_devflow_release_assets.py",
    "openspec/changes/centralize-devflow-authority-delta/.openspec.yaml",
    "openspec/changes/centralize-devflow-authority-delta/design.md",
    "openspec/changes/centralize-devflow-authority-delta/evidence/authority-grant-HG-BASELINE-9366E8A-001.json",
    "openspec/changes/centralize-devflow-authority-delta/evidence/baseline.md",
    "openspec/changes/centralize-devflow-authority-delta/evidence/dev-flow-0.4.0.release-assets.json",
    "openspec/changes/centralize-devflow-authority-delta/evidence/final-independent-review.json",
    "openspec/changes/centralize-devflow-authority-delta/evidence/final-validation-evidence.json",
    "openspec/changes/centralize-devflow-authority-delta/evidence/standing-milestone-contract.json",
    "openspec/changes/centralize-devflow-authority-delta/proposal.md",
    "openspec/changes/centralize-devflow-authority-delta/specs/authority-delta-resolution/spec.md",
    "openspec/changes/centralize-devflow-authority-delta/specs/incidental-finding-lifecycle/spec.md",
    "openspec/changes/centralize-devflow-authority-delta/specs/milestone-external-effects/spec.md",
    "openspec/changes/centralize-devflow-authority-delta/tasks.md",
    "plugins/dev-flow/.codex-plugin/plugin.json",
    "plugins/dev-flow/.codex-plugin/project-migration.json",
    "plugins/dev-flow/.codex-plugin/release-sync.json",
    "plugins/dev-flow/README.md",
    "plugins/dev-flow/assets/templates/AGENTS.md.template",
    "plugins/dev-flow/assets/templates/AGENT_TASK_CONTRACT.md.template",
    "plugins/dev-flow/assets/templates/ENGINEERING_POLICY.md.template",
    "plugins/dev-flow/assets/templates/EVIDENCE_TEMPLATE.md.template",
    "plugins/dev-flow/assets/templates/OPENSPEC_CONFIG.yaml.template",
    "plugins/dev-flow/assets/templates/OPENSPEC_DESIGN.md.template",
    "plugins/dev-flow/assets/templates/OPENSPEC_TASKS.md.template",
    "plugins/dev-flow/assets/templates/REVIEW_CHECKLIST.md.template",
    "plugins/dev-flow/assets/templates/STATE.md.template",
    "plugins/dev-flow/assets/templates/TASK_LEDGER.md.template",
    "plugins/dev-flow/docs/artifact-ownership.md",
    "plugins/dev-flow/docs/dev-flow-0.4.0.release-manifest.json",
    "plugins/dev-flow/docs/dev-flow-release-policy.json",
    "plugins/dev-flow/docs/dev-flow-v0.4.0.md",
    "plugins/dev-flow/docs/generated-artifact-lifecycle.md",